

================================================================
== Vitis HLS Report for 'shift_line_buffer_array_ap_fixed_8_1_4_0_0_6u_config5_s'
================================================================
* Date:           Tue Nov  4 16:13:51 2025

* Version:        2023.2 (Build 4023990 on Oct 11 2023)
* Project:        myproject_prj
* Solution:       solution1 (Vivado IP Flow Target)
* Product family: zynquplus
* Target device:  xczu9eg-ffvb1156-2-e


================================================================
== Performance Estimates
================================================================
+ Timing: 
    * Summary: 
    +--------+---------+----------+------------+
    |  Clock |  Target | Estimated| Uncertainty|
    +--------+---------+----------+------------+
    |ap_clk  |  5.00 ns|  0.717 ns|     1.35 ns|
    +--------+---------+----------+------------+

+ Latency: 
    * Summary: 
    +---------+---------+----------+----------+-----+-----+---------+
    |  Latency (cycles) |  Latency (absolute) |  Interval | Pipeline|
    |   min   |   max   |    min   |    max   | min | max |   Type  |
    +---------+---------+----------+----------+-----+-----+---------+
    |        0|        0|      0 ns|      0 ns|    1|    1|      yes|
    +---------+---------+----------+----------+-----+-----+---------+

    + Detail: 
        * Instance: 
        N/A

        * Loop: 
        N/A

============================================================
+ Verbose Summary: Synthesis Manager
============================================================
InlineROM: 1
ExposeGlobal: 0
============================================================
+ Verbose Summary: CDFG Model
============================================================
IsTopModel: 0
ResetActiveHigh: 1
IsCombinational: 0
IsDatapathOnly: 0
HasWiredReturn: 1
HasMFsm: 2
HasVarLatency: 0
IsPipeline: 1
IsRtlPipelined: 0
IsInstanceOverlapped: 0
IsDontTouch: 0
HasImplIP: 0
IsGatedGlobalClock: 0

+ Individual pipeline summary: 
  * Pipeline-0: initiation interval (II) = 1, depth = 1


============================================================
+ Verbose Summary: Schedule
============================================================
* Number of FSM states : 1
* Pipeline : 1
  Pipeline-0 : II = 1, D = 1, States = { 1 }
* Dataflow Pipeline: 0

* FSM state transitions: 
1 --> 

* FSM state operations: 

State 1 <SV = 0> <Delay = 0.71>
ST_1 : Operation 2 [1/1] (0.00ns)   --->   "%specpipeline_ln232 = specpipeline void @_ssdm_op_SpecPipeline, i32 4294967295, i32 0, i32 0, i32 0, void @empty_1" [firmware/nnet_utils/nnet_conv_stream.h:232]   --->   Operation 2 'specpipeline' 'specpipeline_ln232' <Predicate = true> <Delay = 0.00>
ST_1 : Operation 3 [1/1] (0.00ns)   --->   "%p_read_7 = read i8 @_ssdm_op_Read.ap_auto.i8, i8 %p_read5" [firmware/nnet_utils/nnet_conv_stream.h:241]   --->   Operation 3 'read' 'p_read_7' <Predicate = true> <Delay = 0.00>
ST_1 : Operation 4 [1/1] (0.00ns)   --->   "%p_read_8 = read i8 @_ssdm_op_Read.ap_auto.i8, i8 %p_read4" [firmware/nnet_utils/nnet_conv_stream.h:241]   --->   Operation 4 'read' 'p_read_8' <Predicate = true> <Delay = 0.00>
ST_1 : Operation 5 [1/1] (0.00ns)   --->   "%p_read_9 = read i8 @_ssdm_op_Read.ap_auto.i8, i8 %p_read3" [firmware/nnet_utils/nnet_conv_stream.h:241]   --->   Operation 5 'read' 'p_read_9' <Predicate = true> <Delay = 0.00>
ST_1 : Operation 6 [1/1] (0.00ns)   --->   "%p_read_10 = read i8 @_ssdm_op_Read.ap_auto.i8, i8 %p_read2" [firmware/nnet_utils/nnet_conv_stream.h:241]   --->   Operation 6 'read' 'p_read_10' <Predicate = true> <Delay = 0.00>
ST_1 : Operation 7 [1/1] (0.00ns)   --->   "%p_read_11 = read i8 @_ssdm_op_Read.ap_auto.i8, i8 %p_read1" [firmware/nnet_utils/nnet_conv_stream.h:241]   --->   Operation 7 'read' 'p_read_11' <Predicate = true> <Delay = 0.00>
ST_1 : Operation 8 [1/1] (0.00ns)   --->   "%p_read38 = read i8 @_ssdm_op_Read.ap_auto.i8, i8 %p_read" [firmware/nnet_utils/nnet_conv_stream.h:241]   --->   Operation 8 'read' 'p_read38' <Predicate = true> <Delay = 0.00>
ST_1 : Operation 9 [1/1] (0.71ns)   --->   "%p_011_i = memshiftread i8 @_ssdm_op_MemShiftRead.[24 x i8]P0A, i8 23, i8 %p_read38, i1 1" [firmware/nnet_utils/nnet_conv_stream.h:241]   --->   Operation 9 'memshiftread' 'p_011_i' <Predicate = true> <Delay = 0.71> <CoreInst = "ShiftReg">   --->   Core 77 'ShiftReg' <Latency = 0> <II = 1> <Delay = 0.71> <Storage> <Opcode : 'load' 'memshiftread'> <Ports = 1> <Width = 8> <Depth = 24> <ShiftMem>
ST_1 : Operation 10 [1/1] (0.71ns)   --->   "%p_012_i = memshiftread i8 @_ssdm_op_MemShiftRead.[24 x i8]P0A, i8 23, i8 %p_read_11, i1 1" [firmware/nnet_utils/nnet_conv_stream.h:241]   --->   Operation 10 'memshiftread' 'p_012_i' <Predicate = true> <Delay = 0.71> <CoreInst = "ShiftReg">   --->   Core 77 'ShiftReg' <Latency = 0> <II = 1> <Delay = 0.71> <Storage> <Opcode : 'load' 'memshiftread'> <Ports = 1> <Width = 8> <Depth = 24> <ShiftMem>
ST_1 : Operation 11 [1/1] (0.71ns)   --->   "%p_013_i = memshiftread i8 @_ssdm_op_MemShiftRead.[24 x i8]P0A, i8 23, i8 %p_read_10, i1 1" [firmware/nnet_utils/nnet_conv_stream.h:241]   --->   Operation 11 'memshiftread' 'p_013_i' <Predicate = true> <Delay = 0.71> <CoreInst = "ShiftReg">   --->   Core 77 'ShiftReg' <Latency = 0> <II = 1> <Delay = 0.71> <Storage> <Opcode : 'load' 'memshiftread'> <Ports = 1> <Width = 8> <Depth = 24> <ShiftMem>
ST_1 : Operation 12 [1/1] (0.71ns)   --->   "%p_014_i = memshiftread i8 @_ssdm_op_MemShiftRead.[24 x i8]P0A, i8 23, i8 %p_read_9, i1 1" [firmware/nnet_utils/nnet_conv_stream.h:241]   --->   Operation 12 'memshiftread' 'p_014_i' <Predicate = true> <Delay = 0.71> <CoreInst = "ShiftReg">   --->   Core 77 'ShiftReg' <Latency = 0> <II = 1> <Delay = 0.71> <Storage> <Opcode : 'load' 'memshiftread'> <Ports = 1> <Width = 8> <Depth = 24> <ShiftMem>
ST_1 : Operation 13 [1/1] (0.71ns)   --->   "%p_015_i = memshiftread i8 @_ssdm_op_MemShiftRead.[24 x i8]P0A, i8 23, i8 %p_read_8, i1 1" [firmware/nnet_utils/nnet_conv_stream.h:241]   --->   Operation 13 'memshiftread' 'p_015_i' <Predicate = true> <Delay = 0.71> <CoreInst = "ShiftReg">   --->   Core 77 'ShiftReg' <Latency = 0> <II = 1> <Delay = 0.71> <Storage> <Opcode : 'load' 'memshiftread'> <Ports = 1> <Width = 8> <Depth = 24> <ShiftMem>
ST_1 : Operation 14 [1/1] (0.71ns)   --->   "%p_0_i = memshiftread i8 @_ssdm_op_MemShiftRead.[24 x i8]P0A, i8 23, i8 %p_read_7, i1 1" [firmware/nnet_utils/nnet_conv_stream.h:241]   --->   Operation 14 'memshiftread' 'p_0_i' <Predicate = true> <Delay = 0.71> <CoreInst = "ShiftReg">   --->   Core 77 'ShiftReg' <Latency = 0> <II = 1> <Delay = 0.71> <Storage> <Opcode : 'load' 'memshiftread'> <Ports = 1> <Width = 8> <Depth = 24> <ShiftMem>
ST_1 : Operation 15 [1/1] (0.00ns)   --->   "%void_compute_pool_buffer_2d_array_const_ap_shift_reg_n_filt_stream_kernel_20 = load i8 %void_compute_pool_buffer_2d_array_const_ap_shift_reg_n_filt_stream_kernel_3" [firmware/nnet_utils/nnet_conv_stream.h:196->firmware/nnet_utils/nnet_conv_stream.h:247]   --->   Operation 15 'load' 'void_compute_pool_buffer_2d_array_const_ap_shift_reg_n_filt_stream_kernel_20' <Predicate = true> <Delay = 0.00>
ST_1 : Operation 16 [1/1] (0.00ns)   --->   "%store_ln196 = store i8 %void_compute_pool_buffer_2d_array_const_ap_shift_reg_n_filt_stream_kernel_20, i8 %void_compute_pool_buffer_2d_array_const_ap_shift_reg_n_filt_stream_kernel_9" [firmware/nnet_utils/nnet_conv_stream.h:196->firmware/nnet_utils/nnet_conv_stream.h:247]   --->   Operation 16 'store' 'store_ln196' <Predicate = true> <Delay = 0.00>
ST_1 : Operation 17 [1/1] (0.00ns)   --->   "%void_compute_pool_buffer_2d_array_const_ap_shift_reg_n_filt_stream_kernel_21 = load i8 %void_compute_pool_buffer_2d_array_const_ap_shift_reg_n_filt_stream_kernel_2" [firmware/nnet_utils/nnet_conv_stream.h:196->firmware/nnet_utils/nnet_conv_stream.h:247]   --->   Operation 17 'load' 'void_compute_pool_buffer_2d_array_const_ap_shift_reg_n_filt_stream_kernel_21' <Predicate = true> <Delay = 0.00>
ST_1 : Operation 18 [1/1] (0.00ns)   --->   "%store_ln196 = store i8 %void_compute_pool_buffer_2d_array_const_ap_shift_reg_n_filt_stream_kernel_21, i8 %void_compute_pool_buffer_2d_array_const_ap_shift_reg_n_filt_stream_kernel_8" [firmware/nnet_utils/nnet_conv_stream.h:196->firmware/nnet_utils/nnet_conv_stream.h:247]   --->   Operation 18 'store' 'store_ln196' <Predicate = true> <Delay = 0.00>
ST_1 : Operation 19 [1/1] (0.00ns)   --->   "%void_compute_pool_buffer_2d_array_const_ap_shift_reg_n_filt_stream_kernel_22 = load i8 %void_compute_pool_buffer_2d_array_const_ap_shift_reg_n_filt_stream_kernel_1" [firmware/nnet_utils/nnet_conv_stream.h:196->firmware/nnet_utils/nnet_conv_stream.h:247]   --->   Operation 19 'load' 'void_compute_pool_buffer_2d_array_const_ap_shift_reg_n_filt_stream_kernel_22' <Predicate = true> <Delay = 0.00>
ST_1 : Operation 20 [1/1] (0.00ns)   --->   "%store_ln196 = store i8 %void_compute_pool_buffer_2d_array_const_ap_shift_reg_n_filt_stream_kernel_22, i8 %void_compute_pool_buffer_2d_array_const_ap_shift_reg_n_filt_stream_kernel_7" [firmware/nnet_utils/nnet_conv_stream.h:196->firmware/nnet_utils/nnet_conv_stream.h:247]   --->   Operation 20 'store' 'store_ln196' <Predicate = true> <Delay = 0.00>
ST_1 : Operation 21 [1/1] (0.00ns)   --->   "%void_compute_pool_buffer_2d_array_const_ap_shift_reg_n_filt_stream_kernel_23 = load i8 %void_compute_pool_buffer_2d_array_const_ap_shift_reg_n_filt_stream_kernel" [firmware/nnet_utils/nnet_conv_stream.h:196->firmware/nnet_utils/nnet_conv_stream.h:247]   --->   Operation 21 'load' 'void_compute_pool_buffer_2d_array_const_ap_shift_reg_n_filt_stream_kernel_23' <Predicate = true> <Delay = 0.00>
ST_1 : Operation 22 [1/1] (0.00ns)   --->   "%store_ln196 = store i8 %void_compute_pool_buffer_2d_array_const_ap_shift_reg_n_filt_stream_kernel_23, i8 %void_compute_pool_buffer_2d_array_const_ap_shift_reg_n_filt_stream_kernel_6" [firmware/nnet_utils/nnet_conv_stream.h:196->firmware/nnet_utils/nnet_conv_stream.h:247]   --->   Operation 22 'store' 'store_ln196' <Predicate = true> <Delay = 0.00>
ST_1 : Operation 23 [1/1] (0.00ns)   --->   "%p_ZZN4nnet22compute_pool_buffer_2dINS_5arrayI8ap_fixedILi8ELi1EL9ap_q_mode4EL9ap_68 = load i8 %p_ZZN4nnet22compute_pool_buffer_2dINS_5arrayI8ap_fixedILi8ELi1EL9ap_q_mode4EL9ap_13" [firmware/nnet_utils/nnet_conv_stream.h:196->firmware/nnet_utils/nnet_conv_stream.h:247]   --->   Operation 23 'load' 'p_ZZN4nnet22compute_pool_buffer_2dINS_5arrayI8ap_fixedILi8ELi1EL9ap_q_mode4EL9ap_68' <Predicate = true> <Delay = 0.00>
ST_1 : Operation 24 [1/1] (0.00ns)   --->   "%store_ln196 = store i8 %p_ZZN4nnet22compute_pool_buffer_2dINS_5arrayI8ap_fixedILi8ELi1EL9ap_q_mode4EL9ap_68, i8 %void_compute_pool_buffer_2d_array_const_ap_shift_reg_n_filt_stream_kernel_5" [firmware/nnet_utils/nnet_conv_stream.h:196->firmware/nnet_utils/nnet_conv_stream.h:247]   --->   Operation 24 'store' 'store_ln196' <Predicate = true> <Delay = 0.00>
ST_1 : Operation 25 [1/1] (0.00ns)   --->   "%p_ZZN4nnet22compute_pool_buffer_2dINS_5arrayI8ap_fixedILi8ELi1EL9ap_q_mode4EL9ap_69 = load i8 %p_ZZN4nnet22compute_pool_buffer_2dINS_5arrayI8ap_fixedILi8ELi1EL9ap_q_mode4EL9ap_12" [firmware/nnet_utils/nnet_conv_stream.h:196->firmware/nnet_utils/nnet_conv_stream.h:247]   --->   Operation 25 'load' 'p_ZZN4nnet22compute_pool_buffer_2dINS_5arrayI8ap_fixedILi8ELi1EL9ap_q_mode4EL9ap_69' <Predicate = true> <Delay = 0.00>
ST_1 : Operation 26 [1/1] (0.00ns)   --->   "%store_ln196 = store i8 %p_ZZN4nnet22compute_pool_buffer_2dINS_5arrayI8ap_fixedILi8ELi1EL9ap_q_mode4EL9ap_69, i8 %void_compute_pool_buffer_2d_array_const_ap_shift_reg_n_filt_stream_kernel_4" [firmware/nnet_utils/nnet_conv_stream.h:196->firmware/nnet_utils/nnet_conv_stream.h:247]   --->   Operation 26 'store' 'store_ln196' <Predicate = true> <Delay = 0.00>
ST_1 : Operation 27 [1/1] (0.00ns)   --->   "%p_ZZN4nnet22compute_pool_buffer_2dINS_5arrayI8ap_fixedILi8ELi1EL9ap_q_mode4EL9ap_70 = load i8 %p_ZZN4nnet22compute_pool_buffer_2dINS_5arrayI8ap_fixedILi8ELi1EL9ap_q_mode4EL9ap_5" [firmware/nnet_utils/nnet_conv_stream.h:196->firmware/nnet_utils/nnet_conv_stream.h:247]   --->   Operation 27 'load' 'p_ZZN4nnet22compute_pool_buffer_2dINS_5arrayI8ap_fixedILi8ELi1EL9ap_q_mode4EL9ap_70' <Predicate = true> <Delay = 0.00>
ST_1 : Operation 28 [1/1] (0.00ns)   --->   "%store_ln196 = store i8 %p_ZZN4nnet22compute_pool_buffer_2dINS_5arrayI8ap_fixedILi8ELi1EL9ap_q_mode4EL9ap_70, i8 %p_ZZN4nnet22compute_pool_buffer_2dINS_5arrayI8ap_fixedILi8ELi1EL9ap_q_mode4EL9ap_11" [firmware/nnet_utils/nnet_conv_stream.h:196->firmware/nnet_utils/nnet_conv_stream.h:247]   --->   Operation 28 'store' 'store_ln196' <Predicate = true> <Delay = 0.00>
ST_1 : Operation 29 [1/1] (0.00ns)   --->   "%p_ZZN4nnet22compute_pool_buffer_2dINS_5arrayI8ap_fixedILi8ELi1EL9ap_q_mode4EL9ap_71 = load i8 %p_ZZN4nnet22compute_pool_buffer_2dINS_5arrayI8ap_fixedILi8ELi1EL9ap_q_mode4EL9ap_4" [firmware/nnet_utils/nnet_conv_stream.h:196->firmware/nnet_utils/nnet_conv_stream.h:247]   --->   Operation 29 'load' 'p_ZZN4nnet22compute_pool_buffer_2dINS_5arrayI8ap_fixedILi8ELi1EL9ap_q_mode4EL9ap_71' <Predicate = true> <Delay = 0.00>
ST_1 : Operation 30 [1/1] (0.00ns)   --->   "%store_ln196 = store i8 %p_ZZN4nnet22compute_pool_buffer_2dINS_5arrayI8ap_fixedILi8ELi1EL9ap_q_mode4EL9ap_71, i8 %p_ZZN4nnet22compute_pool_buffer_2dINS_5arrayI8ap_fixedILi8ELi1EL9ap_q_mode4EL9ap_10" [firmware/nnet_utils/nnet_conv_stream.h:196->firmware/nnet_utils/nnet_conv_stream.h:247]   --->   Operation 30 'store' 'store_ln196' <Predicate = true> <Delay = 0.00>
ST_1 : Operation 31 [1/1] (0.00ns)   --->   "%p_ZZN4nnet22compute_pool_buffer_2dINS_5arrayI8ap_fixedILi8ELi1EL9ap_q_mode4EL9ap_72 = load i8 %p_ZZN4nnet22compute_pool_buffer_2dINS_5arrayI8ap_fixedILi8ELi1EL9ap_q_mode4EL9ap_3" [firmware/nnet_utils/nnet_conv_stream.h:196->firmware/nnet_utils/nnet_conv_stream.h:247]   --->   Operation 31 'load' 'p_ZZN4nnet22compute_pool_buffer_2dINS_5arrayI8ap_fixedILi8ELi1EL9ap_q_mode4EL9ap_72' <Predicate = true> <Delay = 0.00>
ST_1 : Operation 32 [1/1] (0.00ns)   --->   "%store_ln196 = store i8 %p_ZZN4nnet22compute_pool_buffer_2dINS_5arrayI8ap_fixedILi8ELi1EL9ap_q_mode4EL9ap_72, i8 %p_ZZN4nnet22compute_pool_buffer_2dINS_5arrayI8ap_fixedILi8ELi1EL9ap_q_mode4EL9ap_9" [firmware/nnet_utils/nnet_conv_stream.h:196->firmware/nnet_utils/nnet_conv_stream.h:247]   --->   Operation 32 'store' 'store_ln196' <Predicate = true> <Delay = 0.00>
ST_1 : Operation 33 [1/1] (0.00ns)   --->   "%p_ZZN4nnet22compute_pool_buffer_2dINS_5arrayI8ap_fixedILi8ELi1EL9ap_q_mode4EL9ap_73 = load i8 %p_ZZN4nnet22compute_pool_buffer_2dINS_5arrayI8ap_fixedILi8ELi1EL9ap_q_mode4EL9ap_2" [firmware/nnet_utils/nnet_conv_stream.h:196->firmware/nnet_utils/nnet_conv_stream.h:247]   --->   Operation 33 'load' 'p_ZZN4nnet22compute_pool_buffer_2dINS_5arrayI8ap_fixedILi8ELi1EL9ap_q_mode4EL9ap_73' <Predicate = true> <Delay = 0.00>
ST_1 : Operation 34 [1/1] (0.00ns)   --->   "%store_ln196 = store i8 %p_ZZN4nnet22compute_pool_buffer_2dINS_5arrayI8ap_fixedILi8ELi1EL9ap_q_mode4EL9ap_73, i8 %p_ZZN4nnet22compute_pool_buffer_2dINS_5arrayI8ap_fixedILi8ELi1EL9ap_q_mode4EL9ap_8" [firmware/nnet_utils/nnet_conv_stream.h:196->firmware/nnet_utils/nnet_conv_stream.h:247]   --->   Operation 34 'store' 'store_ln196' <Predicate = true> <Delay = 0.00>
ST_1 : Operation 35 [1/1] (0.00ns)   --->   "%p_ZZN4nnet22compute_pool_buffer_2dINS_5arrayI8ap_fixedILi8ELi1EL9ap_q_mode4EL9ap_74 = load i8 %p_ZZN4nnet22compute_pool_buffer_2dINS_5arrayI8ap_fixedILi8ELi1EL9ap_q_mode4EL9ap_1" [firmware/nnet_utils/nnet_conv_stream.h:196->firmware/nnet_utils/nnet_conv_stream.h:247]   --->   Operation 35 'load' 'p_ZZN4nnet22compute_pool_buffer_2dINS_5arrayI8ap_fixedILi8ELi1EL9ap_q_mode4EL9ap_74' <Predicate = true> <Delay = 0.00>
ST_1 : Operation 36 [1/1] (0.00ns)   --->   "%store_ln196 = store i8 %p_ZZN4nnet22compute_pool_buffer_2dINS_5arrayI8ap_fixedILi8ELi1EL9ap_q_mode4EL9ap_74, i8 %p_ZZN4nnet22compute_pool_buffer_2dINS_5arrayI8ap_fixedILi8ELi1EL9ap_q_mode4EL9ap_7" [firmware/nnet_utils/nnet_conv_stream.h:196->firmware/nnet_utils/nnet_conv_stream.h:247]   --->   Operation 36 'store' 'store_ln196' <Predicate = true> <Delay = 0.00>
ST_1 : Operation 37 [1/1] (0.00ns)   --->   "%p_ZZN4nnet22compute_pool_buffer_2dINS_5arrayI8ap_fixedILi8ELi1EL9ap_q_mode4EL9ap_75 = load i8 %p_ZZN4nnet22compute_pool_buffer_2dINS_5arrayI8ap_fixedILi8ELi1EL9ap_q_mode4EL9ap_s" [firmware/nnet_utils/nnet_conv_stream.h:196->firmware/nnet_utils/nnet_conv_stream.h:247]   --->   Operation 37 'load' 'p_ZZN4nnet22compute_pool_buffer_2dINS_5arrayI8ap_fixedILi8ELi1EL9ap_q_mode4EL9ap_75' <Predicate = true> <Delay = 0.00>
ST_1 : Operation 38 [1/1] (0.00ns)   --->   "%store_ln196 = store i8 %p_ZZN4nnet22compute_pool_buffer_2dINS_5arrayI8ap_fixedILi8ELi1EL9ap_q_mode4EL9ap_75, i8 %p_ZZN4nnet22compute_pool_buffer_2dINS_5arrayI8ap_fixedILi8ELi1EL9ap_q_mode4EL9ap_6" [firmware/nnet_utils/nnet_conv_stream.h:196->firmware/nnet_utils/nnet_conv_stream.h:247]   --->   Operation 38 'store' 'store_ln196' <Predicate = true> <Delay = 0.00>
ST_1 : Operation 39 [1/1] (0.00ns)   --->   "%store_ln209 = store i8 %p_011_i, i8 %void_compute_pool_buffer_2d_array_const_ap_shift_reg_n_filt_stream_kernel_3" [firmware/nnet_utils/nnet_conv_stream.h:209->firmware/nnet_utils/nnet_conv_stream.h:247]   --->   Operation 39 'store' 'store_ln209' <Predicate = true> <Delay = 0.00>
ST_1 : Operation 40 [1/1] (0.00ns)   --->   "%store_ln209 = store i8 %p_012_i, i8 %void_compute_pool_buffer_2d_array_const_ap_shift_reg_n_filt_stream_kernel_2" [firmware/nnet_utils/nnet_conv_stream.h:209->firmware/nnet_utils/nnet_conv_stream.h:247]   --->   Operation 40 'store' 'store_ln209' <Predicate = true> <Delay = 0.00>
ST_1 : Operation 41 [1/1] (0.00ns)   --->   "%store_ln209 = store i8 %p_013_i, i8 %void_compute_pool_buffer_2d_array_const_ap_shift_reg_n_filt_stream_kernel_1" [firmware/nnet_utils/nnet_conv_stream.h:209->firmware/nnet_utils/nnet_conv_stream.h:247]   --->   Operation 41 'store' 'store_ln209' <Predicate = true> <Delay = 0.00>
ST_1 : Operation 42 [1/1] (0.00ns)   --->   "%store_ln209 = store i8 %p_014_i, i8 %void_compute_pool_buffer_2d_array_const_ap_shift_reg_n_filt_stream_kernel" [firmware/nnet_utils/nnet_conv_stream.h:209->firmware/nnet_utils/nnet_conv_stream.h:247]   --->   Operation 42 'store' 'store_ln209' <Predicate = true> <Delay = 0.00>
ST_1 : Operation 43 [1/1] (0.00ns)   --->   "%store_ln209 = store i8 %p_015_i, i8 %p_ZZN4nnet22compute_pool_buffer_2dINS_5arrayI8ap_fixedILi8ELi1EL9ap_q_mode4EL9ap_13" [firmware/nnet_utils/nnet_conv_stream.h:209->firmware/nnet_utils/nnet_conv_stream.h:247]   --->   Operation 43 'store' 'store_ln209' <Predicate = true> <Delay = 0.00>
ST_1 : Operation 44 [1/1] (0.00ns)   --->   "%store_ln209 = store i8 %p_0_i, i8 %p_ZZN4nnet22compute_pool_buffer_2dINS_5arrayI8ap_fixedILi8ELi1EL9ap_q_mode4EL9ap_12" [firmware/nnet_utils/nnet_conv_stream.h:209->firmware/nnet_utils/nnet_conv_stream.h:247]   --->   Operation 44 'store' 'store_ln209' <Predicate = true> <Delay = 0.00>
ST_1 : Operation 45 [1/1] (0.00ns)   --->   "%store_ln209 = store i8 %p_read38, i8 %p_ZZN4nnet22compute_pool_buffer_2dINS_5arrayI8ap_fixedILi8ELi1EL9ap_q_mode4EL9ap_5" [firmware/nnet_utils/nnet_conv_stream.h:209->firmware/nnet_utils/nnet_conv_stream.h:247]   --->   Operation 45 'store' 'store_ln209' <Predicate = true> <Delay = 0.00>
ST_1 : Operation 46 [1/1] (0.00ns)   --->   "%store_ln209 = store i8 %p_read_11, i8 %p_ZZN4nnet22compute_pool_buffer_2dINS_5arrayI8ap_fixedILi8ELi1EL9ap_q_mode4EL9ap_4" [firmware/nnet_utils/nnet_conv_stream.h:209->firmware/nnet_utils/nnet_conv_stream.h:247]   --->   Operation 46 'store' 'store_ln209' <Predicate = true> <Delay = 0.00>
ST_1 : Operation 47 [1/1] (0.00ns)   --->   "%store_ln209 = store i8 %p_read_10, i8 %p_ZZN4nnet22compute_pool_buffer_2dINS_5arrayI8ap_fixedILi8ELi1EL9ap_q_mode4EL9ap_3" [firmware/nnet_utils/nnet_conv_stream.h:209->firmware/nnet_utils/nnet_conv_stream.h:247]   --->   Operation 47 'store' 'store_ln209' <Predicate = true> <Delay = 0.00>
ST_1 : Operation 48 [1/1] (0.00ns)   --->   "%store_ln209 = store i8 %p_read_9, i8 %p_ZZN4nnet22compute_pool_buffer_2dINS_5arrayI8ap_fixedILi8ELi1EL9ap_q_mode4EL9ap_2" [firmware/nnet_utils/nnet_conv_stream.h:209->firmware/nnet_utils/nnet_conv_stream.h:247]   --->   Operation 48 'store' 'store_ln209' <Predicate = true> <Delay = 0.00>
ST_1 : Operation 49 [1/1] (0.00ns)   --->   "%store_ln209 = store i8 %p_read_8, i8 %p_ZZN4nnet22compute_pool_buffer_2dINS_5arrayI8ap_fixedILi8ELi1EL9ap_q_mode4EL9ap_1" [firmware/nnet_utils/nnet_conv_stream.h:209->firmware/nnet_utils/nnet_conv_stream.h:247]   --->   Operation 49 'store' 'store_ln209' <Predicate = true> <Delay = 0.00>
ST_1 : Operation 50 [1/1] (0.00ns)   --->   "%store_ln209 = store i8 %p_read_7, i8 %p_ZZN4nnet22compute_pool_buffer_2dINS_5arrayI8ap_fixedILi8ELi1EL9ap_q_mode4EL9ap_s" [firmware/nnet_utils/nnet_conv_stream.h:209->firmware/nnet_utils/nnet_conv_stream.h:247]   --->   Operation 50 'store' 'store_ln209' <Predicate = true> <Delay = 0.00>
ST_1 : Operation 51 [1/1] (0.00ns)   --->   "%ret_ln232 = ret" [firmware/nnet_utils/nnet_conv_stream.h:232]   --->   Operation 51 'ret' 'ret_ln232' <Predicate = true> <Delay = 0.00>


============================================================
+ Verbose Summary: Timing violations
============================================================
Target clock period: 5.000ns, clock uncertainty: 1.350ns.

 <State 1>: 0.717ns
The critical path consists of the following:
	wire read operation ('p_read38', firmware/nnet_utils/nnet_conv_stream.h:241) on port 'p_read' (firmware/nnet_utils/nnet_conv_stream.h:241) [37]  (0.000 ns)
	'memshiftread' operation 8 bit ('p_011_i', firmware/nnet_utils/nnet_conv_stream.h:241) [38]  (0.717 ns)


============================================================
+ Verbose Summary: Binding
============================================================
N/A
* FSMD analyzer results:
  - Output states:
 - Input state : 
  - Chain level:
	State 1


============================================================
+ Verbose Summary: Datapath Resource usage 
============================================================
N/A
